{
  "$schema": "http://json-schema.org/draft-07/schema#",
  "title": "pacto-bot-api service compatibility windows",
  "type": "object",
  "properties": {
    "relay": { "$ref": "#/definitions/versionWindow" },
    "evm": { "$ref": "#/definitions/versionWindow" },
    "nostra": { "$ref": "#/definitions/versionWindow" },
    "aztec": { "$ref": "#/definitions/versionWindow" },
    "bunker": { "$ref": "#/definitions/versionWindow" }
  },
  "required": ["relay", "evm", "nostra", "aztec"],
  "additionalProperties": false,
  "relay": { "min_version": "0.0.0", "max_version": "99.99.99" },
  "evm": { "min_version": "0.0.0", "max_version": "99.99.99" },
  "nostra": { "min_version": "0.0.0", "max_version": "99.99.99" },
  "aztec": { "min_version": "0.0.0", "max_version": "99.99.99" },
  "bunker": { "min_version": "0.0.0", "max_version": "99.99.99" },
  "definitions": {
    "versionWindow": {
      "type": "object",
      "properties": {
        "min_version": { "type": "string" },
        "max_version": { "type": "string" }
      },
      "required": ["min_version", "max_version"],
      "additionalProperties": false
    }
  }
}
