{
  "relay": { "min_version": "0.0.0", "max_version": "99.99.99" },
  "evm": { "min_version": "0.0.0", "max_version": "99.99.99" },
  "nostra": { "min_version": "0.0.0", "max_version": "99.99.99" },
  "aztec": { "min_version": "0.0.0", "max_version": "99.99.99" },
  "bunker": { "min_version": "0.0.0", "max_version": "99.99.99" }
}
